{
  "turn_id": "RUN-20260605-SEM-0005",
  "task_id": "TASK-0099",
  "agent": "MysteryAgent",
  "outcome": "in_review",
  "summary": "Invalid semantic turn report from an unregistered agent.",
  "changed_paths": [
    "runtime/orchestrator.py"
  ],
  "transitions": {
    "task_status": { "from": "in_progress", "to": "in_review" },
    "claims": [
      { "op": "release", "claim_id": "CLAIM-TASK-0099-mystery", "scope": ["runtime/"] }
    ],
    "mailbox": [],
    "handoff": null
  },
  "commit_message": "feat(runtime): reject mystery agent",
  "gate": { "human_required": false },
  "next_hint": null
}
